{
  "$schema": "https://json-schema.org/draft/2020-12/schema",
  "$id": "https://agmind.local/contracts/v1/evidence-repair-complete.schema.json",
  "$comment": "Authoritative validation MUST enforce x-agmind-semantic and fail closed if unsupported; see contracts/README.md.",
  "x-agmind-semantic": "EvidenceRepairCompleteV1",
  "type": "object",
  "additionalProperties": false,
  "required": [
    "schema_version",
    "repair_id",
    "authorization_event_id",
    "authorization_content_sha256",
    "segment_id",
    "verified_bytes",
    "post_repair_prefix_sha256",
    "last_verified_frame_sha256",
    "current_chain_head_sha256",
    "reason"
  ],
  "properties": {
    "schema_version": {
      "type": "string",
      "const": "agmind.evidence-repair-complete.v1"
    },
    "repair_id": {
      "$ref": "#/$defs/uuid4"
    },
    "authorization_event_id": {
      "type": "string",
      "pattern": "^evt_[0-9a-f]{64}$"
    },
    "authorization_content_sha256": {
      "$ref": "#/$defs/sha256"
    },
    "segment_id": {
      "$ref": "#/$defs/uuid4"
    },
    "verified_bytes": {
      "type": "integer",
      "minimum": 0,
      "maximum": 67108864
    },
    "post_repair_prefix_sha256": {
      "$ref": "#/$defs/sha256"
    },
    "last_verified_frame_sha256": {
      "$ref": "#/$defs/sha256"
    },
    "current_chain_head_sha256": {
      "$ref": "#/$defs/sha256"
    },
    "reason": {
      "type": "string",
      "const": "torn_open_tail_completed"
    }
  },
  "allOf": [
    {
      "if": {
        "required": [
          "verified_bytes"
        ],
        "properties": {
          "verified_bytes": {
            "const": 0
          }
        }
      },
      "then": {
        "properties": {
          "post_repair_prefix_sha256": {
            "const": "e3b0c44298fc1c149afbf4c8996fb92427ae41e4649b934ca495991b7852b855"
          },
          "last_verified_frame_sha256": {
            "const": "0000000000000000000000000000000000000000000000000000000000000000"
          }
        }
      },
      "else": {
        "properties": {
          "last_verified_frame_sha256": {
            "not": {
              "const": "0000000000000000000000000000000000000000000000000000000000000000"
            }
          }
        }
      }
    }
  ],
  "$defs": {
    "sha256": {
      "type": "string",
      "pattern": "^[0-9a-f]{64}$"
    },
    "uuid4": {
      "type": "string",
      "pattern": "^[0-9a-f]{8}-[0-9a-f]{4}-4[0-9a-f]{3}-[89ab][0-9a-f]{3}-[0-9a-f]{12}$"
    }
  }
}
