{
  "schema_version": "agmind.evidence-repair-complete.v1",
  "repair_id": "11111111-1111-4111-8111-111111111111",
  "authorization_event_id": "evt_5555555555555555555555555555555555555555555555555555555555555555",
  "authorization_content_sha256": "6666666666666666666666666666666666666666666666666666666666666666",
  "segment_id": "22222222-2222-4222-8222-222222222222",
  "verified_bytes": 4096,
  "post_repair_prefix_sha256": "4444444444444444444444444444444444444444444444444444444444444444",
  "last_verified_frame_sha256": "2222222222222222222222222222222222222222222222222222222222222222",
  "current_chain_head_sha256": "3333333333333333333333333333333333333333333333333333333333333333",
  "reason": "torn_open_tail_completed"
}
